{
  "schema_version": "company_audit_financials_v1",
  "company_id": "kumkang-kind",
  "company_name": "금강공업",
  "reporting_entity": "금강공업 주식회사 및 연결종속기업",
  "accounting_standard": {
    "code": "k_ifrs",
    "label_ko": "한국채택국제회계기준",
    "label_en": "K-IFRS"
  },
  "currency": "KRW",
  "unit": "won",
  "audit_opinions": [
    {
      "source_ref": "kumkang_annual_report_2026_03_12",
      "opinion": "unqualified",
      "opinion_label_ko": "적정의견",
      "covered_years": [
        2025
      ],
      "auditor": "안경회계법인",
      "auditor_report_date": "2026-03-12"
    },
    {
      "source_ref": "kumkang_corrected_annual_report_2025_03_19",
      "opinion": "unqualified",
      "opinion_label_ko": "적정의견",
      "covered_years": [
        2024
      ],
      "auditor": "안경회계법인",
      "auditor_report_date": "2025-03-19"
    },
    {
      "source_ref": "kumkang_annual_report_2024_03_14",
      "opinion": "unqualified",
      "opinion_label_ko": "적정의견",
      "covered_years": [
        2023
      ],
      "auditor": "안경회계법인",
      "auditor_report_date": "2024-03-14"
    }
  ],
  "source_documents": {
    "kumkang_annual_report_2026_03_12": {
      "filename": "[금강공업]사업보고서(2026.03.12).pdf",
      "report_date": "2026-03-12",
      "covered_years": [
        2025,
        2024,
        2023
      ],
      "auditor": "안경회계법인",
      "auditor_report_date": "2026-03-12",
      "audit_opinion": "적정의견",
      "source_role": "primary_2025_and_comparative_cross_check"
    },
    "kumkang_corrected_annual_report_2025_03_19": {
      "filename": "[금강공업][정정]사업보고서(2025.03.19).pdf",
      "report_date": "2025-03-19",
      "covered_years": [
        2024,
        2023
      ],
      "auditor": "안경회계법인",
      "auditor_report_date": "2025-03-19",
      "audit_opinion": "적정의견",
      "source_role": "primary_2024_corrected_and_2023_cross_check",
      "usage": "2025-03-13 최초 제출본의 정정보고서로 2024년 최우선 출처"
    },
    "kumkang_annual_report_2024_03_14": {
      "filename": "[금강공업]사업보고서(2024.03.14).pdf",
      "report_date": "2024-03-14",
      "covered_years": [
        2023
      ],
      "auditor": "안경회계법인",
      "auditor_report_date": "2024-03-14",
      "audit_opinion": "적정의견",
      "source_role": "primary_2023"
    }
  },
  "source_priority": {
    "2023": {
      "primary_source_ref": "kumkang_annual_report_2024_03_14",
      "basis": "current_year_financial_statements",
      "cross_check_source_refs": [
        "kumkang_corrected_annual_report_2025_03_19",
        "kumkang_annual_report_2026_03_12"
      ]
    },
    "2024": {
      "primary_source_ref": "kumkang_corrected_annual_report_2025_03_19",
      "basis": "current_year_financial_statements",
      "cross_check_source_refs": [
        "kumkang_annual_report_2026_03_12"
      ]
    },
    "2025": {
      "primary_source_ref": "kumkang_annual_report_2026_03_12",
      "basis": "current_year_financial_statements"
    }
  },
  "financial_years": {
    "2023": {
      "income_statement": {
        "revenue": {
          "reported": 856892700510,
          "source_refs": [
            "kumkang_annual_report_2024_03_14",
            "kumkang_corrected_annual_report_2025_03_19",
            "kumkang_annual_report_2026_03_12"
          ],
          "source_locations": [
            {
              "source_ref": "kumkang_annual_report_2024_03_14",
              "section": "statement.income_statement",
              "verification_status": "pending_manual_page_check"
            }
          ]
        },
        "gross_profit": {
          "reported": 158067345706,
          "source_refs": [
            "kumkang_annual_report_2024_03_14",
            "kumkang_corrected_annual_report_2025_03_19",
            "kumkang_annual_report_2026_03_12"
          ],
          "source_locations": [
            {
              "source_ref": "kumkang_annual_report_2024_03_14",
              "section": "statement.income_statement",
              "verification_status": "pending_manual_page_check"
            }
          ]
        },
        "operating_profit": {
          "reported": 66582089210,
          "source_refs": [
            "kumkang_annual_report_2024_03_14",
            "kumkang_corrected_annual_report_2025_03_19",
            "kumkang_annual_report_2026_03_12"
          ],
          "source_locations": [
            {
              "source_ref": "kumkang_annual_report_2024_03_14",
              "section": "statement.income_statement",
              "verification_status": "pending_manual_page_check"
            }
          ]
        },
        "net_income": {
          "reported": 44788076295,
          "source_refs": [
            "kumkang_annual_report_2024_03_14",
            "kumkang_corrected_annual_report_2025_03_19",
            "kumkang_annual_report_2026_03_12"
          ],
          "source_locations": [
            {
              "source_ref": "kumkang_annual_report_2024_03_14",
              "section": "statement.income_statement",
              "verification_status": "pending_manual_page_check"
            }
          ]
        }
      },
      "balance_sheet": {
        "total_assets": {
          "reported": 1130467709471,
          "source_refs": [
            "kumkang_annual_report_2024_03_14",
            "kumkang_corrected_annual_report_2025_03_19",
            "kumkang_annual_report_2026_03_12"
          ],
          "source_locations": [
            {
              "source_ref": "kumkang_annual_report_2024_03_14",
              "section": "statement.balance_sheet",
              "verification_status": "pending_manual_page_check"
            }
          ]
        },
        "total_liabilities": {
          "reported": 652973754367,
          "source_refs": [
            "kumkang_annual_report_2024_03_14",
            "kumkang_corrected_annual_report_2025_03_19",
            "kumkang_annual_report_2026_03_12"
          ],
          "source_locations": [
            {
              "source_ref": "kumkang_annual_report_2024_03_14",
              "section": "statement.balance_sheet",
              "verification_status": "pending_manual_page_check"
            }
          ]
        },
        "total_equity": {
          "reported": 477493955104,
          "source_refs": [
            "kumkang_annual_report_2024_03_14",
            "kumkang_corrected_annual_report_2025_03_19",
            "kumkang_annual_report_2026_03_12"
          ],
          "source_locations": [
            {
              "source_ref": "kumkang_annual_report_2024_03_14",
              "section": "statement.balance_sheet",
              "verification_status": "pending_manual_page_check"
            }
          ]
        },
        "current_assets": {
          "reported": 455179398404,
          "source_refs": [
            "kumkang_annual_report_2024_03_14",
            "kumkang_corrected_annual_report_2025_03_19",
            "kumkang_annual_report_2026_03_12"
          ],
          "source_locations": [
            {
              "source_ref": "kumkang_annual_report_2024_03_14",
              "section": "statement.balance_sheet",
              "verification_status": "pending_manual_page_check"
            }
          ]
        },
        "current_liabilities": {
          "reported": 529800865935,
          "source_refs": [
            "kumkang_annual_report_2024_03_14",
            "kumkang_corrected_annual_report_2025_03_19",
            "kumkang_annual_report_2026_03_12"
          ],
          "source_locations": [
            {
              "source_ref": "kumkang_annual_report_2024_03_14",
              "section": "statement.balance_sheet",
              "verification_status": "pending_manual_page_check"
            }
          ]
        }
      },
      "cash_flow": {
        "operating_cash_flow": {
          "reported": 49382174440,
          "source_refs": [
            "kumkang_annual_report_2024_03_14",
            "kumkang_corrected_annual_report_2025_03_19",
            "kumkang_annual_report_2026_03_12"
          ],
          "source_locations": [
            {
              "source_ref": "kumkang_annual_report_2024_03_14",
              "section": "statement.cash_flow",
              "verification_status": "pending_manual_page_check"
            }
          ]
        },
        "investing_cash_flow": {
          "reported": -24772943419,
          "source_refs": [
            "kumkang_annual_report_2024_03_14",
            "kumkang_corrected_annual_report_2025_03_19",
            "kumkang_annual_report_2026_03_12"
          ],
          "source_locations": [
            {
              "source_ref": "kumkang_annual_report_2024_03_14",
              "section": "statement.cash_flow",
              "verification_status": "pending_manual_page_check"
            }
          ]
        },
        "financing_cash_flow": {
          "reported": -12637336466,
          "source_refs": [
            "kumkang_annual_report_2024_03_14",
            "kumkang_corrected_annual_report_2025_03_19",
            "kumkang_annual_report_2026_03_12"
          ],
          "source_locations": [
            {
              "source_ref": "kumkang_annual_report_2024_03_14",
              "section": "statement.cash_flow",
              "verification_status": "pending_manual_page_check"
            }
          ]
        },
        "ending_cash": {
          "reported": 102115482662,
          "source_refs": [
            "kumkang_annual_report_2024_03_14",
            "kumkang_corrected_annual_report_2025_03_19",
            "kumkang_annual_report_2026_03_12"
          ],
          "source_locations": [
            {
              "source_ref": "kumkang_annual_report_2024_03_14",
              "section": "statement.cash_flow",
              "verification_status": "pending_manual_page_check"
            }
          ]
        }
      },
      "revenue_breakdown": {
        "goods_revenue": {
          "reported": 0,
          "source_refs": [
            "kumkang_annual_report_2024_03_14",